topic_name,learning_outcome,technical_document
Market Organization and Structure,explain the main functions of the financial system,"The main functions of the financial system include allowing strangers to contract with each other, moving money through time, hedging risks, and exchanging assets. Investors save money for the future, expecting a rate of return, while borrowers move money from the future to the present for current projects. Hedgers trade to reduce risks, and information-motivated traders identify undervalued instruments. Financial intermediaries connect buyers and sellers directly or indirectly, creating instruments that meet specific needs. Clearinghouses, variation margins, and settlement guarantees manage credit risk, enabling strangers to contract safely. Margin loans allow for larger positions and increased risk exposure. Orders instruct trading actions, with market orders filling quickly but at potentially inferior prices, while limit orders may fill at better prices but are not guaranteed. Issuers sell securities through various methods, including public offerings and private placements. Secondary markets are crucial for capital raising, as investors value liquidity. Call markets match buyers and sellers easily, while dealers provide liquidity in quote-driven markets. Order-driven markets arrange trades based on precedence rules, with continuous order-driven markets using discriminatory pricing. Transparent markets have lower transaction costs due to easier market value determination. A well-functioning financial system promotes wealth by facilitating capital allocation decisions and risk sharing. Informationally efficient prices reflect all available information, with liquid markets enhancing informational efficiency. Regulators aim to promote fair and orderly markets with accurate prices and minimal transaction costs. Financial disclosure programs ensure consistent information availability for security valuation by financial analysts."
Market Organization and Structure,describe classifications of assets and markets,"The classification of assets and markets is crucial in understanding how the financial system operates. Assets can be classified into different categories based on their characteristics and features. Markets, on the other hand, can be classified based on how trading is facilitated and the level of liquidity they offer.

Assets can be classified into various categories such as equities, bonds, commodities, real estate, and derivatives. Equities represent ownership in a company, while bonds represent debt obligations. Commodities are physical goods such as gold or oil, and real estate represents property ownership. Derivatives are financial instruments whose value is derived from an underlying asset.

Markets can be classified into primary and secondary markets. Primary markets are where securities are first issued by their issuers, while secondary markets are where these securities are traded after the initial issuance. Markets can also be classified as quote-driven or order-driven. Quote-driven markets rely on dealers to provide liquidity, while order-driven markets match buyers and sellers based on a set of rules.

Understanding these classifications is essential for financial analysts and investors to make informed decisions about asset allocation and trading strategies. By knowing the characteristics of different assets and markets, individuals can better assess risk and return profiles, as well as liquidity levels. This knowledge is crucial for optimizing investment portfolios and achieving financial goals."
Market Organization and Structure,"describe the major types of securities, currencies, contracts, commodities, and real assets that trade in organized markets, including their distinguishing characteristics and major subtypes","The major types of securities, currencies, contracts, commodities, and real assets that trade in organized markets have distinguishing characteristics and major subtypes. Securities are first sold in primary markets by issuers and then trade in secondary markets. Investors can also invest in pooled investment vehicles to benefit from investment management services. Forward contracts allow buyers and sellers to arrange future sales at predetermined prices, while futures contracts are forward contracts guaranteed by clearinghouses. Financial intermediaries play a crucial role in connecting buyers and sellers, acting as brokers, exchanges, dealers, and arbitrageurs.

Margin loans allow individuals to buy more securities than their equity would permit, increasing their exposure to risk. The leverage ratio, calculated as the value of a position divided by the equity supporting it, determines the potential gains and losses. Brokers demand maintenance margin payments to protect against credit losses when adverse price changes reduce a customer's equity below the maintenance margin ratio.

Orders in financial markets provide instructions for trading, specifying the instrument, side (buy or sell), quantity, and additional instructions. Market orders fill quickly but may result in inferior prices, while limit orders offer better prices but may not fill. Stop instructions delay order execution until a stop condition is met. Issuers sell securities through various methods like underwritten public offerings and private placements.

Well-functioning secondary markets are essential for raising capital in primary markets, as investors value liquidity to sell securities when needed. Different market structures like call markets, quote-driven markets, and order-driven markets facilitate trading with varying levels of liquidity and transparency. Liquid markets with low transaction costs promote efficient capital allocation and wealth creation. Regulatory bodies aim to ensure fair and orderly markets with accurate pricing and adequate information disclosure for investors."
Market Organization and Structure,describe types of financial intermediaries and services that they provide,"Financial intermediaries play a crucial role in the financial system by connecting buyers and sellers and providing various services. Table 1 summarizes the types of financial intermediaries and the services they offer.

\[
\begin{array}{|c|c|}
\hline
\textbf{Financial Intermediary} & \textbf{Services Provided} \\
\hline
\text{Brokers} & \text{Act as intermediaries in direct trades between buyers and sellers.} \\
\hline
\text{Exchanges} & \text{Facilitate trading by providing a centralized marketplace for buyers and sellers.} \\
\hline
\text{Dealers} & \text{Provide liquidity by quoting prices at which they are willing to buy or sell securities.} \\
\hline
\text{Arbitrageurs} & \text{Profit from price differences in different markets by buying low and selling high.} \\
\hline
\text{Investment Funds} & \text{Manage pooled investments on behalf of investors to achieve specific financial goals.} \\
\hline
\text{Insurance Companies} & \text{Pool insurance contracts to spread risk among policyholders.} \\
\hline
\end{array}
\]

These financial intermediaries create and trade various instruments, manage investment funds, securitize assets, and provide insurance services. By offering these services, financial intermediaries help individuals and institutions connect with each other to meet their specific financial needs efficiently.

Furthermore, financial intermediaries play a vital role in managing risks in the financial system. For example, clearinghouses guarantee futures contracts, reducing counterparty risk and facilitating trading between strangers. Additionally, brokers enforce maintenance margin requirements to protect against credit losses and ensure the financial stability of their clients.

In conclusion, understanding the types of financial intermediaries and the services they provide is essential for comprehending how the financial system operates and how individuals and institutions can efficiently connect with each other to meet their financial needs."
Market Organization and Structure,compare positions an investor can take in an asset,"The financial system allows investors to take various positions in assets, such as saving, borrowing, hedging, and trading. Investors save money to move it from the present to the future, expecting a rate of return for bearing risk. Borrowers, on the other hand, move money from the future to the present to fund current projects. Hedgers trade to reduce their exposure to risks they prefer not to take, while information-motivated traders actively manage investments based on identifying undervalued instruments.

Investors can also engage in trading activities through different types of contracts, such as forward and futures contracts. Forward contracts allow buyers and sellers to arrange future sales at predetermined prices, while futures contracts are guaranteed by clearinghouses, making them attractive to hedgers and information-motivated traders.

Moreover, investors can leverage their positions by using margin loans, which allow them to buy more securities than their equity would otherwise permit. The leverage ratio, calculated as the value of a position divided by the value of the equity supporting it, determines the exposure to risk and potential returns.

Understanding these different positions and strategies in asset management is crucial for investors to make informed decisions and optimize their investment portfolios."
Market Organization and Structure,"calculate and interpret the leverage ratio, the rate of return on a margin transaction, and the security price at which the investor would receive a margin call","The leverage ratio is a crucial metric in understanding the risk exposure of an investor in a margin transaction. It is calculated as the value of the position divided by the equity supporting it. The leverage ratio determines the extent to which an investor is using borrowed funds to increase their position in the market. A higher leverage ratio indicates a higher level of risk, as gains and losses will be magnified.

In the context of margin trading, investors need to be aware of the rate of return on a margin transaction. The returns to the equity in a position are equal to the leverage ratio times the returns to the unleveraged position. This means that the rate of return on a margin transaction is directly influenced by the leverage ratio. Investors should carefully consider this relationship when engaging in leveraged trading to assess the potential risks and rewards.

Furthermore, investors should be mindful of the security price at which they would receive a margin call. Brokers demand maintenance margin payments from customers who have borrowed cash or securities when adverse price changes cause their equity to drop below the maintenance margin ratio. Understanding the security price at which a margin call would be triggered is essential for investors to manage their positions effectively and avoid forced liquidation.

Overall, a thorough understanding of the leverage ratio, rate of return on margin transactions, and security price for margin calls is crucial for investors engaging in leveraged trading to make informed decisions and effectively manage risks."
Market Organization and Structure,"compare execution, validity, and clearing instructions","The reading discusses the importance of understanding how the financial system operates, particularly in terms of execution, validity, and clearing instructions. Execution refers to the process of carrying out trading decisions, while validity ensures that contracts are honored by all parties involved. Clearing instructions, such as variation margins and settlement guarantees, help manage credit risk and facilitate trading between strangers in the market.

One key aspect highlighted is the use of futures contracts, which are forward contracts guaranteed by clearinghouses. These contracts provide a level of security for traders, ensuring that transactions can be completed without concerns about counterparty risk. This makes futures contract markets attractive to hedgers and information-motivated traders.

Furthermore, the reading discusses the role of brokers in managing credit risk through maintenance margin payments. Brokers demand these payments from customers who have borrowed cash or securities to ensure that their equity remains above a certain threshold. Failure to meet these margin calls can result in the closure of positions.

In terms of order instructions, the reading distinguishes between market orders and limit orders. Market orders fill quickly but may result in inferior prices, while limit orders offer better prices but may not fill at all. Traders must consider their trading objectives and risk tolerance when choosing between these order types.

Overall, the efficient functioning of financial markets relies on mechanisms such as clearinghouses, margin requirements, and order types to facilitate trading while managing risks. Understanding these processes is crucial for financial analysts and traders to make informed decisions in the market."
Market Organization and Structure,compare market orders with limit orders,"Market orders and limit orders are two common types of instructions used in trading. Market orders are executed immediately at the best available price in the market, while limit orders are executed at a specific price or better. Traders choose between these two order types based on their trading strategy and goals.

Market orders are advantageous for traders who prioritize speed of execution over price. They are filled quickly but may result in inferior prices due to potential price fluctuations. On the other hand, limit orders allow traders to specify the price at which they are willing to buy or sell an asset. While limit orders offer the potential for better prices, there is a risk that the order may not be filled if the market does not reach the specified price.

In summary, market orders are suitable for traders who prioritize immediate execution, while limit orders are preferred by those who prioritize price control. Understanding the differences between market and limit orders is essential for traders to effectively manage their trading strategies and achieve their desired outcomes in the financial markets."
Market Organization and Structure,define primary and secondary markets and explain how secondary markets support primary markets,"The primary market is where securities are first sold by their issuers, while the secondary market is where these securities are traded after the initial sale. Secondary markets support primary markets by providing liquidity to investors. Investors are more willing to participate in primary markets if they know they can easily sell their securities in the secondary market if needed. This liquidity reduces the risk for investors, making primary market investments more attractive.

In the context of financial intermediaries, they play a crucial role in connecting buyers and sellers in both primary and secondary markets. They can act as brokers, exchanges, dealers, or arbitrageurs, facilitating transactions and ensuring smooth operations in the markets. Financial intermediaries create instruments through various activities like securitization, borrowing to lend, managing investment funds, and pooling insurance contracts. These instruments help buyers and sellers meet their specific needs in the financial markets.

Furthermore, the presence of clearinghouses, variation margins, maintenance margins, and settlement guarantees provided by creditworthy brokers help manage credit risk in the markets. This management of credit risk allows strangers to contract with each other without worrying about the counterparty's ability to honor the contract. Overall, secondary markets play a vital role in supporting primary markets by providing liquidity, reducing risk for investors, and ensuring efficient operations through the involvement of financial intermediaries and risk management mechanisms."
Market Organization and Structure,"describe how securities, contracts, and currencies are traded in quote-driven, order-driven, and brokered markets","Securities, contracts, and currencies are traded in various types of markets, including quote-driven, order-driven, and brokered markets. In quote-driven markets, dealers provide liquidity by quoting bid and ask prices. On the other hand, order-driven markets match buyers and sellers based on precedence rules and price orders using the discriminatory pricing rule. Brokers facilitate trading in unique instruments or positions that may be difficult to find buyers or sellers for.

In quote-driven markets, dealers play a crucial role in providing liquidity. They quote bid and ask prices at which they are willing to buy and sell securities. This helps ensure that there is a continuous market for trading. On the other hand, order-driven markets rely on matching buyers and sellers based on specific rules. Orders are ranked based on factors such as price, size, and time of arrival. The discriminatory pricing rule is used to determine trade prices based on standing limit orders.

Brokers also play a significant role in facilitating trades in markets where finding a counterparty may be challenging. They help connect buyers and sellers of unique instruments or positions that may not have a readily available market. By providing this intermediary service, brokers help improve market efficiency and liquidity.

Understanding the different types of markets and the roles of dealers, brokers, and order matching rules is essential for financial analysts and traders to make informed decisions when trading securities, contracts, and currencies. By knowing how these markets operate, market participants can better navigate the complexities of the financial system and execute trades effectively."
Market Organization and Structure,describe characteristics of a well-functioning financial system,"A well-functioning financial system is characterized by complete and liquid markets that allow individuals to trade instruments efficiently with low transaction costs. Complete markets offer a wide range of instruments to solve investment and risk management problems, while liquid markets enable traders to easily buy and sell assets when desired. Operational efficiency in the financial system is achieved through liquidity, which reduces the costs associated with raising capital.

Liquid markets play a crucial role in lowering transaction costs and promoting wealth within the economy. By facilitating capital allocation decisions and enabling risk-sharing among market participants, a well-functioning financial system contributes to economic growth. Additionally, informationally efficient prices, driven by information-motivated traders in liquid markets, ensure that asset values reflect all available information accurately.

Regulators aim to create fair and orderly markets where traders can transact at prices that align with fundamental values without excessive costs. Regulatory bodies, both governmental and self-regulating organizations, work towards enhancing market safety and efficiency. Mandated financial disclosure programs for publicly traded securities ensure that essential information is consistently available to financial analysts, promoting transparency and informed decision-making within the financial system."
Market Organization and Structure,describe objectives of market regulation.,"Market regulation aims to promote fair and orderly markets where traders can transact at prices that accurately reflect fundamental values without incurring excessive transaction costs. Regulators, whether governmental agencies or self-regulating organizations, provide oversight to make markets safer and more efficient. One key aspect of market regulation is mandated financial disclosure programs for issuers of publicly traded securities. These programs ensure that information necessary to estimate security values is consistently available to financial analysts.

By requiring issuers to disclose relevant financial information, regulators aim to enhance transparency in the market. This transparency helps investors make informed decisions based on accurate and up-to-date information. Additionally, it promotes market efficiency by reducing information asymmetry between market participants. When all investors have access to the same information, prices are more likely to reflect the true underlying value of securities.

Overall, market regulation plays a crucial role in maintaining the integrity of financial markets and protecting investors. By setting standards for disclosure and transparency, regulators contribute to the smooth functioning of markets and help prevent fraud and manipulation. This ultimately fosters investor confidence and promotes a level playing field for all market participants."
Security Market Indexes,describe a security market index,"Security market indexes are essential tools for investors to measure the values of different target markets. They can be price return indexes, reflecting only the prices of constituent securities, or total return indexes, reflecting both prices and reinvested income. The construction of indexes involves selecting constituent securities that represent the target market and weighting them using various methods like price, equal, market-capitalization, or fundamental weightings. 

Index management includes periodic rebalancing and reconstitution to maintain appropriate weightings and represent the desired target market. Rebalancing and reconstitution create turnover in an index, which can impact prices of current and prospective constituents. Security market indexes serve multiple purposes such as gauging market sentiment, acting as benchmarks for portfolios, measuring systematic risk, and serving as proxies for asset classes in allocation models.

Investors can choose from a wide range of security market indexes representing different asset classes like equity, fixed-income, commodity, real estate, and hedge funds. Index providers offer various indexes within each asset class, from broad market indexes to specialized ones based on geographic region, economic sector, or other factors. Understanding the construction and management of security market indexes is crucial for their proper use in investment decision-making."
Security Market Indexes,"calculate and interpret the value, price return, and total return of an index","Security market indexes are essential tools for investors to measure the values of different target markets. Two key types of indexes are price return indexes and total return indexes. A price return index reflects only the prices of constituent securities, while a total return index reflects both prices and reinvested income. The choice of weighting method in index construction impacts valuation and returns. Index management involves periodic rebalancing and reconstitution to maintain appropriate weightings and represent the target market accurately. Rebalancing and reconstitution can lead to turnover in an index and affect prices of constituents. 

Understanding the value, price return, and total return of an index is crucial for investors to make informed decisions. By calculating and interpreting these metrics, investors can assess the performance of their investments accurately. This knowledge allows investors to select the most appropriate index for their needs and understand how changes in the index composition can impact returns. Proper use of security market indexes relies on a comprehensive understanding of their construction and management, enabling investors to leverage these tools effectively in their investment strategies."
Security Market Indexes,describe the choices and issues in index construction and management,"Index construction involves selecting constituent securities to represent a target market and determining the weighting method. The choice of weighting method, such as price, equal, market-capitalization, or fundamental weightings, impacts index valuation and returns. Index management includes periodic rebalancing and reconstitution to maintain appropriate weightings and represent the desired target market. Rebalancing and reconstitution create turnover in an index, which can affect prices of current and prospective constituents. Understanding index construction and management is crucial for investors to select the most appropriate index for their needs and to effectively use indexes for various purposes such as benchmarking, measuring risk, and asset allocation."
