topic_name,learning_outcome,summary,technical_document
Market Organization and Structure,explain the main functions of the financial system,"This reading introduces how the financial system operates and explains how well-functioning financial systems lead to wealthy economies. Financial analysts need to understand how the financial system works because their analyses often lead to trading decisions.  The financial system consists of markets and the financial intermediaries that operate in them. These institutions allow buyers to connect with sellers. They may trade directly with each other when they trade the same instrument or they only may trade indirectly when a financial intermediary connects the buyer to the seller through transactions with each that appear on the intermediary’s balance sheet. The buyer and seller may exchange instruments, cash flows, or risks.  The following points, among others, were made in this reading:  The financial system consists of mechanisms that allow strangers to contract with each other to move money through time, to hedge risks, and to exchange assets that they value less for those that they value more.Investors move money from the present to the future when they save. They expect a normal rate of return for bearing risk through time. Borrowers move money from the future to the present to fund current projects and expenditures. Hedgers trade to reduce their exposure to risks they prefer not to take. Information-motivated traders are active investment managers who try to identify under- and overvalued instruments.Securities are first sold in primary markets by their issuers. They then trade in secondary markets.People invest in pooled investment vehicles to benefit from the investment management services of their managers.Forward contracts allow buyers and sellers to arrange for future sales at predetermined prices. Futures contracts are forward contracts guaranteed by clearinghouses. The guarantee ensures that strangers are willing to trade with each other and that traders can offset their positions by trading with anybody. These features of futures contract markets make them highly attractive to hedgers and information-motivated traders.Many financial intermediaries connect buyers to sellers in a given instrument, acting directly as brokers and exchanges or indirectly as dealers and arbitrageurs.Financial intermediaries create instruments when they conduct arbitrage, securitize assets, borrow to lend, manage investment funds, or pool insurance contracts. These activities all transform cash flows and risks from one form to another. Their services allow buyers and sellers to connect with each other through instruments that meet their specific needs.Financial markets work best when strangers can contract with each other without worrying about whether their counterparts are able and willing to honor their contract. Clearinghouses, variation margins, maintenance margins, and settlement guarantees made by creditworthy brokers on behalf of their clients help manage credit risk and ultimately allow strangers to contract with each other.Information-motivated traders short sell when they expect that prices will fall. Hedgers short sell to reduce the risks of a long position in a related contract or commodity.Margin loans allow people to buy more securities than their equity would otherwise permit them to buy. The larger positions expose them to more risk so that gains and losses for a given amount of equity will be larger. The leverage ratio is the value of a position divided by the value of the equity supporting it. The returns to the equity in a position are equal to the leverage ratio times the returns to the unleveraged position.To protect against credit losses, brokers demand maintenance margin payments from their customers who have borrowed cash or securities when adverse price changes cause their customer’s equity to drop below the maintenance margin ratio. Brokers close positions for customers who do not satisfy these margin calls.Orders are instructions to trade. They always specify instrument, side (buy or sell), and quantity. They usually also provide several other instructions.Market orders tend to fill quickly but often at inferior prices. Limit orders generally fill at better prices if they fill, but they may not fill. Traders choose order submission strategies on the basis of how quickly they want to trade, the prices they are willing to accept, and the consequences of failing to trade.Stop instructions are attached to other orders to delay efforts to fill them until the stop condition is satisfied. Although stop orders are often used to stop losses, they are not always effective.Issuers sell their securities using underwritten public offerings, best efforts public offerings, private placements, shelf registrations, dividend reinvestment programs, and rights offerings. Investment banks have a conflict of interests when setting the initial offering price in an IPO.Well-functioning secondary markets are essential to raising capital in the primary markets because investors value the ability to sell their securities if they no longer want to hold them or if they need to disinvest to raise cash. If they cannot trade their securities in a liquid market, they will not pay as much for them.Matching buyers and sellers in call markets is easy because the traders (or their orders) come together at the same time and place.Dealers provide liquidity in quote-driven markets. Public traders as well as dealers provide liquidity in order-driven markets.Order-driven markets arrange trades by ranking orders using precedence rules. The rules generally ensure that traders who provide the best prices, display the most size, and arrive early trade first. Continuous order-driven markets price orders using the discriminatory pricing rule. Under this rule, standing limit orders determine trade prices.Brokers help people trade unique instruments or positions for which finding a buyer or a seller is difficult.Transaction costs are lower in transparent markets than in opaque markets because traders can more easily determine market value and more easily manage their trading in transparent markets.A well-functioning financial system allows people to trade instruments that best solve their wealth and risk management problems with low transaction costs. Complete and liquid markets characterize a well-functioning financial system. Complete markets are markets in which the instruments needed to solve investment and risk management problems are available to trade. Liquid markets are markets in which traders can trade when they want to trade at low cost.The financial system is operationally efficient when its markets are liquid. Liquid markets lower the costs of raising capital.A well-functioning financial system promotes wealth by ensuring that capital allocation decisions are well made. A well-functioning financial system also promotes wealth by allowing people to share the risks associated with valuable products that would otherwise not be undertaken.Prices are informationally efficient when they reflect all available information about fundamental values. Information-motivated traders make prices informationally efficient. Prices will be most informative in liquid markets because information-motivated traders will not invest in information and research if establishing positions based on their analyses is too costly.Regulators generally seek to promote fair and orderly markets in which traders can trade at prices that accurately reflect fundamental values without incurring excessive transaction costs. Governmental agencies and self-regulating organizations of practitioners provide regulatory services that attempt to make markets safer and more efficient.Mandated financial disclosure programs for the issuers of publicly traded securities ensure that information necessary to estimate security values is available to financial analysts on a consistent basis.","The main functions of the financial system include allowing strangers to contract with each other, moving money through time, hedging risks, and exchanging assets. Investors save money for the future, expecting a rate of return, while borrowers move money from the future to the present. Hedgers trade to reduce risks, and information-motivated traders identify undervalued instruments. Financial intermediaries connect buyers and sellers, creating instruments that meet specific needs. Clearinghouses, variation margins, and settlement guarantees manage credit risk. Margin loans allow for larger positions, increasing risk and potential returns. Orders specify trading instructions, with market orders filling quickly but at potentially inferior prices, while limit orders may fill at better prices but are not guaranteed. Issuers sell securities through various methods, with investment banks facing conflicts of interest in setting IPO prices. Secondary markets are crucial for raising capital in primary markets. Call markets match buyers and sellers easily, while dealers provide liquidity in quote-driven markets. Order-driven markets arrange trades based on precedence rules, with continuous order-driven markets using discriminatory pricing. Transparent markets have lower transaction costs due to easier price determination. A well-functioning financial system promotes wealth by facilitating capital allocation decisions and risk sharing. Informationally efficient prices reflect all available information, with liquid markets being most informative. Regulators aim to promote fair and orderly markets with accurate prices and minimal transaction costs. Financial disclosure programs ensure consistent information availability for financial analysts."
Market Organization and Structure,describe classifications of assets and markets,"This reading introduces how the financial system operates and explains how well-functioning financial systems lead to wealthy economies. Financial analysts need to understand how the financial system works because their analyses often lead to trading decisions.  The financial system consists of markets and the financial intermediaries that operate in them. These institutions allow buyers to connect with sellers. They may trade directly with each other when they trade the same instrument or they only may trade indirectly when a financial intermediary connects the buyer to the seller through transactions with each that appear on the intermediary’s balance sheet. The buyer and seller may exchange instruments, cash flows, or risks.  The following points, among others, were made in this reading:  The financial system consists of mechanisms that allow strangers to contract with each other to move money through time, to hedge risks, and to exchange assets that they value less for those that they value more.Investors move money from the present to the future when they save. They expect a normal rate of return for bearing risk through time. Borrowers move money from the future to the present to fund current projects and expenditures. Hedgers trade to reduce their exposure to risks they prefer not to take. Information-motivated traders are active investment managers who try to identify under- and overvalued instruments.Securities are first sold in primary markets by their issuers. They then trade in secondary markets.People invest in pooled investment vehicles to benefit from the investment management services of their managers.Forward contracts allow buyers and sellers to arrange for future sales at predetermined prices. Futures contracts are forward contracts guaranteed by clearinghouses. The guarantee ensures that strangers are willing to trade with each other and that traders can offset their positions by trading with anybody. These features of futures contract markets make them highly attractive to hedgers and information-motivated traders.Many financial intermediaries connect buyers to sellers in a given instrument, acting directly as brokers and exchanges or indirectly as dealers and arbitrageurs.Financial intermediaries create instruments when they conduct arbitrage, securitize assets, borrow to lend, manage investment funds, or pool insurance contracts. These activities all transform cash flows and risks from one form to another. Their services allow buyers and sellers to connect with each other through instruments that meet their specific needs.Financial markets work best when strangers can contract with each other without worrying about whether their counterparts are able and willing to honor their contract. Clearinghouses, variation margins, maintenance margins, and settlement guarantees made by creditworthy brokers on behalf of their clients help manage credit risk and ultimately allow strangers to contract with each other.Information-motivated traders short sell when they expect that prices will fall. Hedgers short sell to reduce the risks of a long position in a related contract or commodity.Margin loans allow people to buy more securities than their equity would otherwise permit them to buy. The larger positions expose them to more risk so that gains and losses for a given amount of equity will be larger. The leverage ratio is the value of a position divided by the value of the equity supporting it. The returns to the equity in a position are equal to the leverage ratio times the returns to the unleveraged position.To protect against credit losses, brokers demand maintenance margin payments from their customers who have borrowed cash or securities when adverse price changes cause their customer’s equity to drop below the maintenance margin ratio. Brokers close positions for customers who do not satisfy these margin calls.Orders are instructions to trade. They always specify instrument, side (buy or sell), and quantity. They usually also provide several other instructions.Market orders tend to fill quickly but often at inferior prices. Limit orders generally fill at better prices if they fill, but they may not fill. Traders choose order submission strategies on the basis of how quickly they want to trade, the prices they are willing to accept, and the consequences of failing to trade.Stop instructions are attached to other orders to delay efforts to fill them until the stop condition is satisfied. Although stop orders are often used to stop losses, they are not always effective.Issuers sell their securities using underwritten public offerings, best efforts public offerings, private placements, shelf registrations, dividend reinvestment programs, and rights offerings. Investment banks have a conflict of interests when setting the initial offering price in an IPO.Well-functioning secondary markets are essential to raising capital in the primary markets because investors value the ability to sell their securities if they no longer want to hold them or if they need to disinvest to raise cash. If they cannot trade their securities in a liquid market, they will not pay as much for them.Matching buyers and sellers in call markets is easy because the traders (or their orders) come together at the same time and place.Dealers provide liquidity in quote-driven markets. Public traders as well as dealers provide liquidity in order-driven markets.Order-driven markets arrange trades by ranking orders using precedence rules. The rules generally ensure that traders who provide the best prices, display the most size, and arrive early trade first. Continuous order-driven markets price orders using the discriminatory pricing rule. Under this rule, standing limit orders determine trade prices.Brokers help people trade unique instruments or positions for which finding a buyer or a seller is difficult.Transaction costs are lower in transparent markets than in opaque markets because traders can more easily determine market value and more easily manage their trading in transparent markets.A well-functioning financial system allows people to trade instruments that best solve their wealth and risk management problems with low transaction costs. Complete and liquid markets characterize a well-functioning financial system. Complete markets are markets in which the instruments needed to solve investment and risk management problems are available to trade. Liquid markets are markets in which traders can trade when they want to trade at low cost.The financial system is operationally efficient when its markets are liquid. Liquid markets lower the costs of raising capital.A well-functioning financial system promotes wealth by ensuring that capital allocation decisions are well made. A well-functioning financial system also promotes wealth by allowing people to share the risks associated with valuable products that would otherwise not be undertaken.Prices are informationally efficient when they reflect all available information about fundamental values. Information-motivated traders make prices informationally efficient. Prices will be most informative in liquid markets because information-motivated traders will not invest in information and research if establishing positions based on their analyses is too costly.Regulators generally seek to promote fair and orderly markets in which traders can trade at prices that accurately reflect fundamental values without incurring excessive transaction costs. Governmental agencies and self-regulating organizations of practitioners provide regulatory services that attempt to make markets safer and more efficient.Mandated financial disclosure programs for the issuers of publicly traded securities ensure that information necessary to estimate security values is available to financial analysts on a consistent basis.","The classification of assets and markets is crucial in understanding how the financial system operates. Assets can be classified into different categories based on their characteristics and features. Markets, on the other hand, can be classified based on how trading occurs and the level of liquidity they offer.

Assets can be classified into various categories such as equities, fixed income securities, derivatives, commodities, and real estate. Equities represent ownership in a company, while fixed income securities represent debt obligations. Derivatives are financial instruments whose value is derived from an underlying asset, commodity, or index. Commodities are physical goods that can be traded, and real estate represents property or land.

Markets can be classified into primary and secondary markets. Primary markets are where securities are first issued and sold by their issuers, while secondary markets are where these securities are traded after the initial issuance. Markets can also be classified into quote-driven and order-driven markets. Quote-driven markets rely on dealers to provide liquidity and set prices, while order-driven markets match buyers and sellers based on a set of rules.

Understanding these classifications is essential for financial analysts and investors to make informed decisions about asset allocation and trading strategies. By knowing the characteristics of different assets and markets, individuals can better assess risk, return potential, and liquidity of their investments."
