topic_name,learning_outcome,summary,technical_document
Security Market Indexes,describe types of equity indexes,"This reading explains and illustrates the construction, management, and uses of security market indexes. It also discusses various types of indexes. Security market indexes are invaluable tools for investors, who can select from among thousands of indexes representing a variety of security markets, market segments, and asset classes. These indexes range from those representing the global market for major asset classes to those representing alternative investments in specific geographic markets. To benefit from the use of security market indexes, investors must understand their construction and determine whether the selected index is appropriate for their purposes. Frequently, an index that is well suited for one purpose may not be well suited for other purposes. Users of indexes must be familiar with how various indexes are constructed in order to select the index or indexes most appropriate for their needs.  Among the key points made in this reading are the following:  Security market indexes are intended to measure the values of different target markets (security markets, market segments, or asset classes).The constituent securities selected for inclusion in the security market index are intended to represent the target market.A price return index reflects only the prices of the constituent securities.A total return index reflects not only the prices of the constituent securities but also the reinvestment of all income received since the inception of the index.Methods used to weight the constituents of an index range from the very simple, such as price and equal weightings, to the more complex, such as market-capitalization and fundamental weightings.Choices in index construction—in particular, the choice of weighting method—affect index valuation and returns.Index management includes 1) periodic rebalancing to ensure that the index maintains appropriate weightings and 2) reconstitution to ensure the index represents the desired target market.Rebalancing and reconstitution create turnover in an index. Reconstitution can dramatically affect prices of current and prospective constituents.Indexes serve a variety of purposes. They gauge market sentiment and serve as benchmarks for actively managed portfolios. They act as proxies for measuring systematic risk and risk-adjusted performance. They also serve as proxies for asset classes in asset allocation models and as model portfolios for investment products.Investors can choose from security market indexes representing various asset classes, including equity, fixed-income, commodity, real estate, and hedge fund indexes.Within most asset classes, index providers offer a wide variety of indexes, ranging from broad market indexes to highly specialized indexes based on the issuer’s geographic region, economic development group, or economic sector or other factors.Proper use of security market indexes depends on understanding their construction and management.","Security market indexes are essential tools for investors, offering a wide range of options to suit different investment needs. The types of equity indexes vary based on the target market they represent and the methodology used for construction. The key points to consider include the distinction between price return indexes and total return indexes, as well as the different weighting methods employed.

For example, market-capitalization weighting is a common method that reflects the market value of each constituent security. On the other hand, fundamental weighting considers factors such as earnings or book value. Understanding these different methodologies is crucial for investors to select the most appropriate index for their investment objectives.

Furthermore, index management practices such as periodic rebalancing and reconstitution play a significant role in maintaining the index's representativeness of the target market. Rebalancing ensures appropriate weightings are maintained, while reconstitution may lead to turnover in the index composition, impacting prices of current and potential constituents.

In conclusion, investors must have a thorough understanding of the construction and management of security market indexes to effectively utilize them in their investment strategies. By selecting the right type of equity index that aligns with their goals and risk tolerance, investors can benefit from using these indexes as benchmarks, proxies for asset classes, and tools for measuring performance and risk."
Security Market Indexes,describe types of fixed-income indexes,"This reading explains and illustrates the construction, management, and uses of security market indexes. It also discusses various types of indexes. Security market indexes are invaluable tools for investors, who can select from among thousands of indexes representing a variety of security markets, market segments, and asset classes. These indexes range from those representing the global market for major asset classes to those representing alternative investments in specific geographic markets. To benefit from the use of security market indexes, investors must understand their construction and determine whether the selected index is appropriate for their purposes. Frequently, an index that is well suited for one purpose may not be well suited for other purposes. Users of indexes must be familiar with how various indexes are constructed in order to select the index or indexes most appropriate for their needs.  Among the key points made in this reading are the following:  Security market indexes are intended to measure the values of different target markets (security markets, market segments, or asset classes).The constituent securities selected for inclusion in the security market index are intended to represent the target market.A price return index reflects only the prices of the constituent securities.A total return index reflects not only the prices of the constituent securities but also the reinvestment of all income received since the inception of the index.Methods used to weight the constituents of an index range from the very simple, such as price and equal weightings, to the more complex, such as market-capitalization and fundamental weightings.Choices in index construction—in particular, the choice of weighting method—affect index valuation and returns.Index management includes 1) periodic rebalancing to ensure that the index maintains appropriate weightings and 2) reconstitution to ensure the index represents the desired target market.Rebalancing and reconstitution create turnover in an index. Reconstitution can dramatically affect prices of current and prospective constituents.Indexes serve a variety of purposes. They gauge market sentiment and serve as benchmarks for actively managed portfolios. They act as proxies for measuring systematic risk and risk-adjusted performance. They also serve as proxies for asset classes in asset allocation models and as model portfolios for investment products.Investors can choose from security market indexes representing various asset classes, including equity, fixed-income, commodity, real estate, and hedge fund indexes.Within most asset classes, index providers offer a wide variety of indexes, ranging from broad market indexes to highly specialized indexes based on the issuer’s geographic region, economic development group, or economic sector or other factors.Proper use of security market indexes depends on understanding their construction and management.","Security market indexes are essential tools for investors, providing a way to measure the values of different target markets. There are two main types of indexes: price return indexes and total return indexes. Price return indexes only reflect the prices of constituent securities, while total return indexes also consider the reinvestment of all income received since the inception of the index.

The construction of indexes involves selecting constituent securities that represent the target market and weighting them accordingly. Weighting methods can range from simple (price and equal weightings) to complex (market-capitalization and fundamental weightings). The choice of weighting method can significantly impact index valuation and returns.

Index management includes periodic rebalancing to maintain appropriate weightings and reconstitution to ensure the index accurately represents the target market. Rebalancing and reconstitution can lead to turnover in an index, which may affect the prices of current and potential constituents.

Investors can choose from a wide range of security market indexes representing various asset classes, including equity, fixed-income, commodity, real estate, and hedge fund indexes. Indexes serve multiple purposes such as gauging market sentiment, acting as benchmarks for portfolios, measuring systematic risk, and serving as proxies for asset classes in asset allocation models.

Understanding the construction and management of security market indexes is crucial for their proper use in investment decision-making."
Security Market Indexes,describe indexes representing alternative investments,"This reading explains and illustrates the construction, management, and uses of security market indexes. It also discusses various types of indexes. Security market indexes are invaluable tools for investors, who can select from among thousands of indexes representing a variety of security markets, market segments, and asset classes. These indexes range from those representing the global market for major asset classes to those representing alternative investments in specific geographic markets. To benefit from the use of security market indexes, investors must understand their construction and determine whether the selected index is appropriate for their purposes. Frequently, an index that is well suited for one purpose may not be well suited for other purposes. Users of indexes must be familiar with how various indexes are constructed in order to select the index or indexes most appropriate for their needs.  Among the key points made in this reading are the following:  Security market indexes are intended to measure the values of different target markets (security markets, market segments, or asset classes).The constituent securities selected for inclusion in the security market index are intended to represent the target market.A price return index reflects only the prices of the constituent securities.A total return index reflects not only the prices of the constituent securities but also the reinvestment of all income received since the inception of the index.Methods used to weight the constituents of an index range from the very simple, such as price and equal weightings, to the more complex, such as market-capitalization and fundamental weightings.Choices in index construction—in particular, the choice of weighting method—affect index valuation and returns.Index management includes 1) periodic rebalancing to ensure that the index maintains appropriate weightings and 2) reconstitution to ensure the index represents the desired target market.Rebalancing and reconstitution create turnover in an index. Reconstitution can dramatically affect prices of current and prospective constituents.Indexes serve a variety of purposes. They gauge market sentiment and serve as benchmarks for actively managed portfolios. They act as proxies for measuring systematic risk and risk-adjusted performance. They also serve as proxies for asset classes in asset allocation models and as model portfolios for investment products.Investors can choose from security market indexes representing various asset classes, including equity, fixed-income, commodity, real estate, and hedge fund indexes.Within most asset classes, index providers offer a wide variety of indexes, ranging from broad market indexes to highly specialized indexes based on the issuer’s geographic region, economic development group, or economic sector or other factors.Proper use of security market indexes depends on understanding their construction and management.","Security market indexes are essential tools for investors to measure the values of different target markets, market segments, or asset classes. The construction and management of these indexes play a crucial role in their effectiveness. Indexes can represent a wide range of asset classes, including alternative investments such as hedge funds.

Alternative investments are typically represented by specialized indexes that focus on specific geographic markets or economic sectors. These indexes provide investors with a benchmark to evaluate the performance of their alternative investment portfolios. Understanding the construction of these alternative investment indexes is important for investors to ensure that they are suitable for their investment objectives.

For example, a hedge fund index may use different weighting methods such as market-capitalization or fundamental weightings to reflect the performance of the underlying hedge fund investments. By selecting the appropriate index that aligns with their investment strategy, investors can effectively track the performance of their alternative investments.

In conclusion, investors can choose from a variety of security market indexes representing alternative investments such as hedge funds. Understanding the construction and management of these indexes is crucial for investors to make informed decisions and effectively evaluate the performance of their alternative investment portfolios."
Security Market Indexes,compare types of security market indexes.,"This reading explains and illustrates the construction, management, and uses of security market indexes. It also discusses various types of indexes. Security market indexes are invaluable tools for investors, who can select from among thousands of indexes representing a variety of security markets, market segments, and asset classes. These indexes range from those representing the global market for major asset classes to those representing alternative investments in specific geographic markets. To benefit from the use of security market indexes, investors must understand their construction and determine whether the selected index is appropriate for their purposes. Frequently, an index that is well suited for one purpose may not be well suited for other purposes. Users of indexes must be familiar with how various indexes are constructed in order to select the index or indexes most appropriate for their needs.  Among the key points made in this reading are the following:  Security market indexes are intended to measure the values of different target markets (security markets, market segments, or asset classes).The constituent securities selected for inclusion in the security market index are intended to represent the target market.A price return index reflects only the prices of the constituent securities.A total return index reflects not only the prices of the constituent securities but also the reinvestment of all income received since the inception of the index.Methods used to weight the constituents of an index range from the very simple, such as price and equal weightings, to the more complex, such as market-capitalization and fundamental weightings.Choices in index construction—in particular, the choice of weighting method—affect index valuation and returns.Index management includes 1) periodic rebalancing to ensure that the index maintains appropriate weightings and 2) reconstitution to ensure the index represents the desired target market.Rebalancing and reconstitution create turnover in an index. Reconstitution can dramatically affect prices of current and prospective constituents.Indexes serve a variety of purposes. They gauge market sentiment and serve as benchmarks for actively managed portfolios. They act as proxies for measuring systematic risk and risk-adjusted performance. They also serve as proxies for asset classes in asset allocation models and as model portfolios for investment products.Investors can choose from security market indexes representing various asset classes, including equity, fixed-income, commodity, real estate, and hedge fund indexes.Within most asset classes, index providers offer a wide variety of indexes, ranging from broad market indexes to highly specialized indexes based on the issuer’s geographic region, economic development group, or economic sector or other factors.Proper use of security market indexes depends on understanding their construction and management.","Security market indexes are essential tools for investors to measure the values of different target markets. There are two main types of indexes: price return indexes and total return indexes. Price return indexes only reflect the prices of constituent securities, while total return indexes also include the reinvestment of all income received since the inception of the index. The choice of weighting method in index construction, such as price, equal, market-capitalization, or fundamental weightings, can significantly impact index valuation and returns.

Index management involves periodic rebalancing to maintain appropriate weightings and reconstitution to ensure the index represents the desired target market. Rebalancing and reconstitution can lead to turnover in an index and affect the prices of current and prospective constituents. Security market indexes serve various purposes, including gauging market sentiment, acting as benchmarks for portfolios, measuring systematic risk and performance, and serving as proxies for asset classes in allocation models.

Investors can select from a wide range of security market indexes representing different asset classes like equity, fixed-income, commodity, real estate, and hedge funds. Within each asset class, there are various indexes available, from broad market indexes to specialized ones based on geographic region, economic development group, economic sector, or other factors. Understanding the construction and management of security market indexes is crucial for their proper use in investment decision-making."
Overview of Equity Securities,describe characteristics of types of equity securities,"Equity securities play a fundamental role in investment analysis and portfolio management. The importance of this asset class continues to grow on a global scale because of the need for equity capital in developed and emerging markets, technological innovation, and the growing sophistication of electronic information exchange. Given their absolute return potential and ability to impact the risk and return characteristics of portfolios, equity securities are of importance to both individual and institutional investors.  This reading introduces equity securities and provides an overview of global equity markets. A detailed analysis of their historical performance shows that equity securities have offered average real annual returns superior to government bills and bonds, which have provided average real annual returns that have only kept pace with inflation. The different types and characteristics of common and preference equity securities are examined, and the primary differences between public and private equity securities are outlined. An overview of the various types of equity securities listed and traded in global markets is provided, including a discussion of their risk and return characteristics. Finally, the role of equity securities in creating company value is examined as well as the relationship between a company’s cost of equity, its accounting return on equity, investors’ required rate of return, and the company’s intrinsic value.  We conclude with a summary of the key components of this reading:  Common shares represent an ownership interest in a company and give investors a claim on its operating performance, the opportunity to participate in the corporate decision-making process, and a claim on the company’s net assets in the case of liquidation.Callable common shares give the issuer the right to buy back the shares from shareholders at a price determined when the shares are originally issued.Putable common shares give shareholders the right to sell the shares back to the issuer at a price specified when the shares are originally issued.Preference shares are a form of equity in which payments made to preference shareholders take precedence over any payments made to common stockholders.Cumulative preference shares are preference shares on which dividend payments are accrued so that any payments omitted by the company must be paid before another dividend can be paid to common shareholders. Non-cumulative preference shares have no such provisions, implying that the dividend payments are at the company’s discretion and are thus similar to payments made to common shareholders.Participating preference shares allow investors to receive the standard preferred dividend plus the opportunity to receive a share of corporate profits above a pre-specified amount. Non-participating preference shares allow investors to simply receive the initial investment plus any accrued dividends in the event of liquidation.Callable and putable preference shares provide issuers and investors with the same rights and obligations as their common share counterparts.Private equity securities are issued primarily to institutional investors in private placements and do not trade in secondary equity markets. There are three types of private equity investments: venture capital, leveraged buyouts, and private investments in public equity (PIPE).The objective of private equity investing is to increase the ability of the company’s management to focus on its operating activities for long-term value creation. The strategy is to take the “private” company “public” after certain profit and other benchmarks have been met.Depository receipts are securities that trade like ordinary shares on a local exchange but which represent an economic interest in a foreign company. They allow the publicly listed shares of foreign companies to be traded on an exchange outside their domestic market.American depository receipts are US dollar-denominated securities trading much like standard US securities on US markets. Global depository receipts are similar to ADRs but contain certain restrictions in terms of their ability to be resold among investors.Underlying characteristics of equity securities can greatly affect their risk and return.A company’s accounting return on equity is the total return that it earns on shareholders’ book equity.A company’s cost of equity is the minimum rate of return that stockholders require the company to pay them for investing in its equity.","Equity securities can be categorized into common equity securities and preference equity securities, each with its own unique characteristics. Common shares represent ownership in a company and provide investors with various rights such as participation in decision-making and claims on assets in case of liquidation. Callable common shares give the issuer the right to repurchase shares at a predetermined price, while putable common shares give shareholders the right to sell shares back to the issuer at a specified price. Preference shares, on the other hand, have priority over common stockholders in terms of dividend payments and liquidation proceeds. Cumulative preference shares accrue unpaid dividends, while non-cumulative preference shares do not.

Private equity securities are issued to institutional investors in private placements and are not traded on secondary markets. They include venture capital, leveraged buyouts, and private investments in public equity (PIPE). The objective of private equity investing is to enhance long-term value creation by allowing management to focus on operational activities. Depository receipts, such as American depository receipts (ADRs) and global depository receipts (GDRs), enable foreign companies' shares to be traded on international exchanges.

Understanding the characteristics of equity securities is crucial for investors to assess their risk and return profiles. A company's accounting return on equity reflects the return earned on shareholders' equity, while the cost of equity represents the minimum rate of return required by stockholders. By comprehending these fundamental concepts, investors can make informed decisions when investing in equity securities."
