|question|answer
45|1. Question: Which of the following statements about preference shares is correct?  Options: A. Cumulative preference shares have no provisions for dividend payments. B. Non-cumulative preference shares allow investors to receive a share of corporate profits above a pre-specified amount. C. Participating preference shares give the issuer the right to buy back the shares from shareholders at a price determined when the shares are originally issued. D. Callable preference shares provide investors with the same rights and obligations as their common share counterparts.|: B. Non-cumulative preference shares allow investors to receive a share of corporate profits above a pre-specified amount.  Explanation: Non-cumulative preference shares have no provisions for dividend payments, implying that the dividend payments are at the company’s discretion and are similar to payments made to common shareholders. On the other hand, cumulative preference shares are preference shares on which dividend payments are accrued so that any payments omitted by the company must be paid before another dividend can be paid to common shareholders. Participating preference shares allow investors to receive the standard preferred dividend plus the opportunity to receive a share of corporate profits above a pre-specified amount. Callable preference shares give the issuer the right to buy back the shares from shareholders at a price determined when the shares are originally issued.
46|2. Question: What is the minimum rate of return that stockholders require the company to pay them for investing in its equity known as?  Options: A. Accounting return on equity B. Cost of equity C. Return on investment D. Dividend yield|: B. Cost of equity  Explanation: The cost of equity is the minimum rate of return that stockholders require the company to pay them for investing in its equity. It represents the return that investors expect to receive for bearing the risk of owning the company's equity. Accounting return on equity is the total return that a company earns on shareholders’ book equity, not the minimum rate of return required by stockholders. Return on investment is a broader measure of profitability that includes all sources of capital, not just equity. Dividend yield is the ratio of dividends paid by a company to its shareholders relative to its stock price.
47|3. Question: Which type of securities represent an ownership interest in a company and give investors a claim on its operating performance and net assets in the case of liquidation?  Options: A. Preference shares B. Private equity securities C. Common shares D. Depository receipts|: C. Common shares  Explanation: Common shares represent an ownership interest in a company and give investors a claim on its operating performance, the opportunity to participate in the corporate decision-making process, and a claim on the company’s net assets in the case of liquidation. Preference shares are a form of equity in which payments made to preference shareholders take precedence over any payments made to common stockholders. Private equity securities are issued primarily to institutional investors in private placements and do not trade in secondary equity markets. Depository receipts are securities that trade like ordinary shares on a local exchange but represent an economic interest in a foreign company.
48|4. Question: What type of securities are issued primarily to institutional investors in private placements and do not trade in secondary equity markets?  Options: A. Common shares B. Preference shares C. Private equity securities D. Depository receipts|: C. Private equity securities  Explanation: Private equity securities are issued primarily to institutional investors in private placements and do not trade in secondary equity markets. Common shares represent an ownership interest in a company and are publicly traded on stock exchanges. Preference shares are a form of equity in which payments made to preference shareholders take precedence over any payments made to common stockholders. Depository receipts are securities that trade like ordinary shares on a local exchange but represent an economic interest in a foreign company.
49|5. Question: Which type of securities allow publicly listed shares of foreign companies to be traded on an exchange outside their domestic market?  Options: A. Common shares B. Preference shares C. Private equity securities D. Depository receipts|: D. Depository receipts  Explanation: Depository receipts are securities that trade like ordinary shares on a local exchange but represent an economic interest in a foreign company. American depository receipts are US dollar-denominated securities trading much like standard US securities on US markets. Global depository receipts are similar to ADRs but contain certain restrictions in terms of their ability to be resold among investors. Common shares represent an ownership interest in a company and are publicly traded on stock exchanges. Preference shares are a form of equity in which payments made to preference shareholders take precedence over any payments made to common stockholders.
